Kategori,Tempat,Rating Tempat,Total Ulasan,Nama Reviewer,Bintang,Tanggal,Ulasan,teks_cleaned,teks_normalized,teks_final,topik,sentimen,sentimen_score
Kesehatan,Puskesmas Kebomas,3.9,558,MINET AE,1,2026-07-20T02:07:23.613Z,"Peserta bpjs luar kota ,kartu bpjs tidak bisa digunakan ,padahal harusnya bisa digunakan gratis 3 x dalam 1 bulan Didepan ruang daftar diterangakan 1 kali berobat gratis Trus masuk poli umum ,malah disuruh bayar Akhirnya pakai umum ,daftar suruh bayar 25 ribu, Bukanya tidak punya uang ,tapi percuma bayat bpjs tiap bulan tidak bisa dipakai Buruk sekali",peserta bpjs luar kota kartu bpjs tidak bisa digunakan padahal harusnya bisa digunakan gratis x dalam bulan didepan ruang daftar diterangakan kali berobat gratis trus masuk poli umum malah disuruh bayar akhirnya pakai umum daftar suruh bayar ribu bukanya tidak punya uang tapi percuma bayat bpjs tiap bulan tidak bisa dipakai buruk sekali,peserta bpjs luar kota kartu bpjs tidak bisa digunakan padahal harusnya bisa digunakan gratis x dalam bulan didepan ruang daftar diterangakan kali berobat gratis trus masuk poli umum malah disuruh bayar akhirnya pakai umum daftar suruh bayar ribu bukanya tidak punya uang tapi percuma bayat bpjs tiap bulan tidak bisa dipakai buruk sekali,peserta bpjs luar kota kartu bpjs digunakan padahal harusnya digunakan gratis bulan didepan ruang daftar diterangakan kali berobat gratis trus masuk poli umum malah disuruh bayar akhirnya pakai umum daftar suruh bayar ribu bukanya punya uang percuma bayat bpjs tiap bulan dipakai buruk,Kesehatan,Positif,0.9962
Kesehatan,Puskesmas Kebomas,3.9,558,Novia Hendrawahyu,5,2026-07-15T01:45:45.786Z,"Terima kasih untuk pelayanan di poli KIA, pelayanan sangat baik, Bu bidan dan dokter sangat ramah😘",terima kasih untuk pelayanan di poli kia pelayanan sangat baik bu bidan dan dokter sangat ramah,terima kasih untuk pelayanan di poli kia pelayanan sangat baik bu bidan dan dokter sangat ramah,terima kasih pelayanan poli kia pelayanan baik bu bidan dokter ramah,Pelayanan,Negatif,0.9896
Kesehatan,Puskesmas Kebomas,3.9,558,Emilia Puspita,5,2026-07-07T02:28:14.554Z,"Pelayanan ramah, cepet, antrinya gak panjang.",pelayanan ramah cepet antrinya gak panjang,pelayanan ramah cepet antrinya tidak panjang,pelayanan ramah cepet antrinya panjang,Pelayanan,Negatif,0.995
Kesehatan,Puskesmas Kebomas,3.9,558,Gresica Rismachul Jannah,5,2026-07-06T01:51:43.738Z,"Pelayanan memuaskan, tenaga kesehatan ramah dan baik. Petugas parkir ramah dan solutif, jika tdk ada tempat parkir dicarikan tempat.",pelayanan memuaskan tenaga kesehatan ramah dan baik petugas parkir ramah dan solutif jika tdk ada tempat parkir dicarikan tempat,pelayanan memuaskan tenaga kesehatan ramah dan baik petugas parkir ramah dan solutif jika tidak ada tempat parkir dicarikan tempat,pelayanan memuaskan tenaga kesehatan ramah baik petugas parkir ramah solutif tempat parkir dicarikan tempat,Pelayanan,Negatif,0.8833
Kesehatan,Puskesmas Kebomas,3.9,558,Hikmaha Alfianti,1,2026-07-04T01:42:46.636Z,"pelayanan buruk, minta rujukan bolak balik selalu di persulit. sudah dapat surat dari rumah sakit untuk minta rujukan dari puskesmas tetap di tolak padahal kondisi pasien sudah sangat memerlukan rujukan tersebut.",pelayanan buruk minta rujukan bolak balik selalu di persulit sudah dapat surat dari rumah sakit untuk minta rujukan dari puskesmas tetap di tolak padahal kondisi pasien sudah sangat memerlukan rujukan tersebut,pelayanan buruk minta rujukan bolak balik selalu di persulit sudah dapat surat dari rumah sakit untuk minta rujukan dari puskesmas tetap di tolak padahal kondisi pasien sudah sangat memerlukan rujukan tersebut,pelayanan buruk minta rujukan bolak balik selalu persulit surat rumah sakit minta rujukan puskesmas tetap tolak padahal kondisi pasien memerlukan rujukan tersebut,Pelayanan,Positif,0.9904
Kesehatan,Puskesmas Kebomas,3.9,558,Devi Agustina,1,2026-07-02T14:04:38.214Z,"Urgen cabut gigi karena ank saya sakit kalau makan. Bagaimana bisa seorang dokter gigi slaah cabut gigi. Harusnya yg goyang sebelahnya, malah dicabut yg gak goyang. Perlu dipertanyakan apakah dokter gigi benar2 dokter gigi atau abal2. Saya pakai Umum bukan BPJS. Bagaimana dengan gigi anak saya? lain kali kalau cabut yg bener apalagi anak kecil",urgen cabut gigi karena ank saya sakit kalau makan bagaimana bisa seorang dokter gigi slaah cabut gigi harusnya yg goyang sebelahnya malah dicabut yg gak goyang perlu dipertanyakan apakah dokter gigi benar2 dokter gigi atau abal2 saya pakai umum bukan bpjs bagaimana dengan gigi anak saya lain kali kalau cabut yg bener apalagi anak kecil,urgen cabut gigi karena ank saya sakit kalau makan bagaimana bisa seorang dokter gigi slaah cabut gigi harusnya yang goyang sebelahnya malah dicabut yang tidak goyang perlu dipertanyakan apakah dokter gigi benar2 dokter gigi atau abal2 saya pakai umum bukan bpjs bagaimana dengan gigi anak saya lain kali kalau cabut yang bener apalagi anak kecil,urgen cabut gigi ank sakit makan bagaimana seorang dokter gigi slaah cabut gigi harusnya goyang sebelahnya malah dicabut goyang perlu dipertanyakan apakah dokter gigi benar2 dokter gigi abal2 pakai umum bukan bpjs bagaimana gigi anak lain kali cabut bener apalagi anak kecil,Kesehatan,Positif,0.9941
Kesehatan,Puskesmas Kebomas,3.9,558,xdexax_,1,2026-06-29T11:45:58.236Z,"judes judes pelayanannya cuman dibagian ahli gizi aja yg engga. smoga ibu dokter/perawat yg di ahli gizi diberikan kebaikan yg melimpah ya bu ❤ . beda lagi di poli kia,malah ga dijelasin detail,ditanya keluhan apa? tapi ga dijelasin karna apa ato apa, dokternya juga. sibuk ngobrol tuh poli kia. ga recommend buat yg mau ke puskesmas bomas pelayanan ga bangett kalo ada bintang 0 aja ini mahh ga pantes dikasi bintang. bad attitude soalnya",judes judes pelayanannya cuman dibagian ahli gizi aja yg engga smoga ibu dokter perawat yg di ahli gizi diberikan kebaikan yg melimpah ya bu beda lagi di poli kia malah ga dijelasin detail ditanya keluhan apa tapi ga dijelasin karna apa ato apa dokternya juga sibuk ngobrol tuh poli kia ga recommend buat yg mau ke puskesmas bomas pelayanan ga bangett kalo ada bintang aja ini mahh ga pantes dikasi bintang bad attitude soalnya,judes judes pelayanannya cuman dibagian ahli gizi aja yang engga smoga ibu dokter perawat yang di ahli gizi diberikan kebaikan yang melimpah ya bu beda lagi di poli kia malah tidak dijelasin detail ditanya keluhan apa tapi tidak dijelasin karna apa ato apa dokternya juga sibuk ngobrol tuh poli kia tidak recommend buat yang mau ke puskesmas bomas pelayanan tidak bangett kalo ada bintang aja ini mahh tidak pantes dikasi bintang bad attitude soalnya,judes judes pelayanannya cuman dibagian ahli gizi aja engga smoga ibu dokter perawat ahli gizi diberikan kebaikan melimpah ya bu beda poli kia malah dijelasin detail ditanya keluhan apa dijelasin karna apa ato apa dokternya sibuk ngobrol tuh poli kia recommend buat mau puskesmas bomas pelayanan bangett kalo bintang aja mahh pantes dikasi bintang bad attitude soalnya,Pelayanan,Positif,0.8632
Kesehatan,Puskesmas Kebomas,3.9,558,Mukhlas sin,3,2026-06-26T00:09:00.881Z,Lama. harusnya jam 7 pas sudah buka. tapi ini saya tunggu sampai jam 7 lebih 10 belum juga dibuka pelayanannya. huft,lama harusnya jam pas sudah buka tapi ini saya tunggu sampai jam lebih belum juga dibuka pelayanannya huft,lama harusnya jam pas sudah buka tapi ini saya tunggu sampai jam lebih belum juga dibuka pelayanannya huft,lama harusnya jam pas buka tunggu sampai jam dibuka pelayanannya huft,Pelayanan,Positif,0.9559
Kesehatan,Puskesmas Kebomas,3.9,558,Golden Eye99,5,2026-06-23T15:04:33.123Z,"Tempatnya rapi bersih, petugasnya ramah, dokternya baikk👍🙏",tempatnya rapi bersih petugasnya ramah dokternya baikk,tempatnya rapi bersih petugasnya ramah dokternya baikk,tempatnya rapi bersih petugasnya ramah dokternya baikk,Pelayanan,Negatif,0.9968
Kesehatan,Puskesmas Kebomas,3.9,558,Coco Milo,5,2026-06-23T01:28:04.862Z,"Puskesmasnya bersih, rapi. Dokter di poli lansia baik sopan melayani dan solutif. Terima kasih Puskesmas Kebomas👍👍👍👍",puskesmasnya bersih rapi dokter di poli lansia baik sopan melayani dan solutif terima kasih puskesmas kebomas,puskesmasnya bersih rapi dokter di poli lansia baik sopan melayani dan solutif terima kasih puskesmas kebomas,puskesmasnya bersih rapi dokter poli lansia baik sopan melayani solutif terima kasih puskesmas kebomas,Fasilitas,Negatif,0.9878
Kesehatan,Puskesmas Kebomas,3.9,558,Yosafat Elohimio Susanto,5,2026-06-23T01:20:12.799Z,Pelayanannya baik dan petugasnya ramah. Semoga terus dipertahankan,pelayanannya baik dan petugasnya ramah semoga terus dipertahankan,pelayanannya baik dan petugasnya ramah semoga terus dipertahankan,pelayanannya baik petugasnya ramah semoga terus dipertahankan,Pelayanan,Negatif,0.9939
Kesehatan,Puskesmas Kebomas,3.9,558,asisten 777,1,2026-06-21T23:30:34.095Z,"pelayanan UGD gk responsif, terkesan sombong.",pelayanan ugd gk responsif terkesan sombong,pelayanan ugd tidak responsif terkesan sombong,pelayanan ugd responsif terkesan sombong,Pelayanan,Positif,0.9979
Kesehatan,Puskesmas Kebomas,3.9,558,Cicin Nabella,5,2026-06-21T10:15:35.349Z,"Puas dengan pelayanan rawat luka pasca operasi di Puskesmas Kebomas. Petugas ramah, penanganan sangat baik dan profesional, tempat bersih, serta pelayanannya cepat. Terima kasih",puas dengan pelayanan rawat luka pasca operasi di puskesmas kebomas petugas ramah penanganan sangat baik dan profesional tempat bersih serta pelayanannya cepat terima kasih,puas dengan pelayanan rawat luka pasca operasi di puskesmas kebomas petugas ramah penanganan sangat baik dan profesional tempat bersih serta pelayanannya cepat terima kasih,puas pelayanan rawat luka pasca operasi puskesmas kebomas petugas ramah penanganan baik profesional tempat bersih serta pelayanannya cepat terima kasih,Pelayanan,Negatif,0.9906
Kesehatan,Puskesmas Kebomas,3.9,558,Finda Aini,5,2026-06-20T09:37:04.295Z,"Baik, ramah, respon cepat",baik ramah respon cepat,baik ramah respon cepat,baik ramah respon cepat,Pelayanan,Negatif,0.9819
Kesehatan,Puskesmas Kebomas,3.9,558,Guntur Setiawan,3,2026-06-12T11:44:12.701Z,"Mau tanya, apakah malam bisa kita mengurus surat keterangan sehat",mau tanya apakah malam bisa kita mengurus surat keterangan sehat,mau tanya apakah malam bisa kita mengurus surat keterangan sehat,mau tanya apakah malam mengurus surat keterangan sehat,Administrasi,Netral,0.9974
Kesehatan,Puskesmas Kebomas,3.9,558,ilfina indah,5,2026-05-31T01:42:53.690Z,"Pelayanan di poli giginya the best, Semuanya ramah, pelayanannya bagus Dapat obat lengkap",pelayanan di poli giginya the best semuanya ramah pelayanannya bagus dapat obat lengkap,pelayanan di poli giginya the best semuanya ramah pelayanannya bagus dapat obat lengkap,pelayanan poli giginya the best semuanya ramah pelayanannya bagus obat lengkap,Pelayanan,Negatif,0.9973
Kesehatan,Puskesmas Kebomas,3.9,558,Adeeva Nayla,1,2026-05-11T02:08:46.507Z,"pelayanan dokter di poli lansia sangat buruk, saya hanya menanyakan apakah nama pasien sdh dipanggil atau blm karna posisi saya mengurus 2 rujukan di poli yg berbeda barangkali tidak terdengar saat dipanggil tetapi dokternya ngomel & jawab ketus dengan alasan ""ngeriwuk i dan nggupuhi""",pelayanan dokter di poli lansia sangat buruk saya hanya menanyakan apakah nama pasien sdh dipanggil atau blm karna posisi saya mengurus rujukan di poli yg berbeda barangkali tidak terdengar saat dipanggil tetapi dokternya ngomel jawab ketus dengan alasan ngeriwuk i dan nggupuhi,pelayanan dokter di poli lansia sangat buruk saya hanya menanyakan apakah nama pasien sudah dipanggil atau belum karna posisi saya mengurus rujukan di poli yang berbeda barangkali tidak terdengar saat dipanggil tetapi dokternya ngomel jawab ketus dengan alasan ngeriwuk i dan nggupuhi,pelayanan dokter poli lansia buruk hanya menanyakan apakah nama pasien dipanggil karna posisi mengurus rujukan poli berbeda barangkali terdengar dipanggil dokternya ngomel jawab ketus alasan ngeriwuk nggupuhi,Pelayanan,Positif,0.997
Kesehatan,Puskesmas Kebomas,3.9,558,Susi Kartika,5,2026-05-05T02:07:17.344Z,"Poli lansia pelayanannya Bagus dan baik , terutama dokter dan pendamping dokter. trmksh Ats pelayanan.",poli lansia pelayanannya bagus dan baik terutama dokter dan pendamping dokter trmksh ats pelayanan,poli lansia pelayanannya bagus dan baik terutama dokter dan pendamping dokter trmksh ats pelayanan,poli lansia pelayanannya bagus baik terutama dokter pendamping dokter trmksh ats pelayanan,Pelayanan,Negatif,0.9597
Kesehatan,Puskesmas Kebomas,3.9,558,Cicik Sri,5,2026-05-05T02:05:47.391Z,Petugase sip luar biasa,petugase sip luar biasa,petugase sip luar biasa,petugase sip luar biasa,Pelayanan,Negatif,0.9916
Kesehatan,Puskesmas Kebomas,3.9,558,Ana Mirrizkillah,5,2026-05-02T07:08:19.943Z,Mantap pelayanan nya,mantap pelayanan nya,bagus pelayanan nya,bagus pelayanan,Pelayanan,Negatif,0.9964
Kesehatan,Puskesmas Kebomas,3.9,558,Ferry Kusumawardhana,5,2026-05-02T02:48:19.306Z,Keren,keren,bagus,bagus,Lainnya,Negatif,0.9961
Kesehatan,Puskesmas Kebomas,3.9,558,Alesia,1,2026-04-29T07:16:33.153Z,"Penanganan pasien sangat buruk. Saya datang jauh jauh, malah tidak diberi obat yang sesuai dengan keluhan saya, ketika saya minta surat dokter, tidak diberi. Kecewa sekali",penanganan pasien sangat buruk saya datang jauh jauh malah tidak diberi obat yang sesuai dengan keluhan saya ketika saya minta surat dokter tidak diberi kecewa sekali,penanganan pasien sangat buruk saya datang jauh jauh malah tidak diberi obat yang sesuai dengan keluhan saya ketika saya minta surat dokter tidak diberi kecewa sekali,penanganan pasien buruk datang jauh jauh malah diberi obat sesuai keluhan minta surat dokter diberi kecewa,Kesehatan,Positif,0.9965
Kesehatan,Puskesmas Kebomas,3.9,558,Cicici Cuwit,5,2026-04-27T06:32:18.030Z,"Hari ini saya periksa iva di poli kia, alhamdulillah prosesnya cepat, sama bidannya dijelasin tentang periksa pd, sangat bermanfaat alhamdulillah 👍🏻",hari ini saya periksa iva di poli kia alhamdulillah prosesnya cepat sama bidannya dijelasin tentang periksa pd sangat bermanfaat alhamdulillah,hari ini saya periksa iva di poli kia alhamdulillah prosesnya cepat sama bidannya dijelasin tentang periksa pada sangat bermanfaat alhamdulillah,hari periksa iva poli kia alhamdulillah prosesnya cepat sama bidannya dijelasin tentang periksa bermanfaat alhamdulillah,Pelayanan,Negatif,0.9281
Kesehatan,Puskesmas Kebomas,3.9,558,Laily Manis,5,2026-04-27T04:51:16.597Z,"ALHAMDULILLAH barusan saya periksa IVA di poli KIA PUSKESMAS KEBOMAS .. Petugas nya sangat ramah dalam memberikan pelayanan untuk pasien nya saat di lakukan pemeriksaan untuk menghilangkan rasa tegang pasien, bu bidan mengajak si pasien ngobrol rileks sampe pemeriksaan selesai alhasil si pasien gak tegang karena takut .. Terimakasih bu bidan atas pelayanan nya yang ramah 🥰🥰🥰🥰",alhamdulillah barusan saya periksa iva di poli kia puskesmas kebomas petugas nya sangat ramah dalam memberikan pelayanan untuk pasien nya saat di lakukan pemeriksaan untuk menghilangkan rasa tegang pasien bu bidan mengajak si pasien ngobrol rileks sampe pemeriksaan selesai alhasil si pasien gak tegang karena takut terimakasih bu bidan atas pelayanan nya yang ramah,alhamdulillah barusan saya periksa iva di poli kia puskesmas kebomas petugas nya sangat ramah dalam memberikan pelayanan untuk pasien nya saat di lakukan pemeriksaan untuk menghilangkan rasa tegang pasien bu bidan mengajak si pasien ngobrol rileks sampe pemeriksaan selesai alhasil si pasien tidak tegang karena takut terimakasih bu bidan atas pelayanan nya yang ramah,alhamdulillah barusan periksa iva poli kia puskesmas kebomas petugas ramah memberikan pelayanan pasien lakukan pemeriksaan menghilangkan rasa tegang pasien bu bidan mengajak si pasien ngobrol rileks sampe pemeriksaan selesai alhasil si pasien tegang takut terimakasih bu bidan atas pelayanan ramah,Pelayanan,Negatif,0.8766
