Kategori,Tempat,Rating Tempat,Total Ulasan,Nama Reviewer,Bintang,Tanggal,Ulasan,teks_cleaned,teks_normalized,teks_final,topik,sentimen,sentimen_score
Wisata,Pantai Kerrong,4.7,15,Shafiq Razak,5,2024-08-11T02:26:17.662Z,Nice place im from malaysia surprised to see so many beautiful places in Bawean,nice place im from malaysia surprised to see so many beautiful places in bawean,nice place im from malaysia surprised to see so many beautiful places in bawean,nice place im from malaysia surprised to see so many beautiful places in bawean,Fasilitas,Negatif,0.9408
Wisata,Pantai Kerrong,4.7,15,Penegak Aturan,4,2023-03-16T16:03:01.268Z,Masih menjadi lokasi favorit untuk menghabiskan waktu bersama keluarga hanya saja mungkin bisa sedikit dijaga kebersihan dan toiletnya,masih menjadi lokasi favorit untuk menghabiskan waktu bersama keluarga hanya saja mungkin bisa sedikit dijaga kebersihan dan toiletnya,masih menjadi lokasi favorit untuk menghabiskan waktu bersama keluarga hanya saja mungkin bisa sedikit dijaga kebersihan dan toiletnya,menjadi lokasi favorit menghabiskan waktu bersama keluarga hanya saja mungkin sedikit dijaga kebersihan toiletnya,Fasilitas,Negatif,0.9941
Wisata,Pantai Kerrong,4.7,15,Hafisul Arifin,5,2022-09-29T17:20:30.407Z,"The view is superb and you can see two different color of the sea and also you can see the island which is noko island if im not mistaken, i think I’m not having a chance to go those white sand island but if you come here give it a chance!!! They said it was one of the wonderful place if you came to the bawean island. There is a fee to go this place which 5000rp per motorcycle if im not mistaken. There is shop also inside there to get a snack and drinks.",the view is superb and you can see two different color of the sea and also you can see the island which is noko island if im not mistaken i think im not having a chance to go those white sand island but if you come here give it a chance they said it was one of the wonderful place if you came to the bawean island there is a fee to go this place which 5000rp per motorcycle if im not mistaken there is shop also inside there to get a snack and drinks,the view is superb and you can see two different color of the sea and also you can see the island which is noko island if im not mistaken i think im not having a chance to go those white sand island but if you come here give it a chance they said it was one of the wonderful place if you came to the bawean island there is a fee to go this place which 5000rp per motorcycle if im not mistaken there is shop also inside there to get a snack and drinks,the view is superb and you can see two different color of the sea and also you can see the island which is noko island if im not mistaken think im not having chance to go those white sand island but if you come here give it chance they said it was one of the wonderful place if you came to the bawean island there is fee to go this place which 5000rp per motorcycle if im not mistaken there is shop also inside there to get snack and drinks,Fasilitas,Negatif,0.5584
Wisata,Pantai Kerrong,4.7,15,Ari Zeta,5,2022-09-07T02:13:20.971Z,"Pathway : Easy access for solo tourist.Because it connected to look out point and stair to access downstair to beach area.  Place : A small pier that stretches around 300 meter to the sea.The sea water is clear,you can see the bottom of the sea clearly and this area still have wildlife.",pathway easy access for solo tourist because it connected to look out point and stair to access downstair to beach area place a small pier that stretches around meter to the sea the sea water is clear you can see the bottom of the sea clearly and this area still have wildlife,pathway easy access for solo tourist because it connected to look out point and stair to access downstair to beach area place a small pier that stretches around meter to the sea the sea water is clear you can see the bottom of the sea clearly and this area still have wildlife,pathway easy access for solo tourist because it connected to look out point and stair to access downstair to beach area place small pier that stretches around meter to the sea the sea water is clear you can see the bottom of the sea clearly and this area still have wildlife,Fasilitas,Negatif,0.5283
Wisata,Pantai Kerrong,4.7,15,Channel Inspirasi Bersama,5,2022-08-15T22:43:37.652Z,"Pantai yang ada di bawean Bisa melihat pulau gili dan noko Pantainya cukup bersih namun rumputnya tumbuh tinggi tidak dibersihkan Kalo mau mandi bisa bilas di tepi pantai sudah disiapkan tempat bilas, airnya mengalir",pantai yang ada di bawean bisa melihat pulau gili dan noko pantainya cukup bersih namun rumputnya tumbuh tinggi tidak dibersihkan kalo mau mandi bisa bilas di tepi pantai sudah disiapkan tempat bilas airnya mengalir,pantai yang ada di bawean bisa melihat pulau gili dan noko pantainya cukup bersih namun rumputnya tumbuh tinggi tidak dibersihkan kalo mau mandi bisa bilas di tepi pantai sudah disiapkan tempat bilas airnya mengalir,pantai bawean melihat pulau gili noko pantainya cukup bersih rumputnya tumbuh tinggi dibersihkan kalo mau mandi bilas tepi pantai disiapkan tempat bilas airnya mengalir,Fasilitas,Negatif,0.9877
Wisata,Pantai Kerrong,4.7,15,Saya Anam,5,2021-12-03T08:35:26.598Z,Bagus,bagus,bagus,bagus,Lainnya,Negatif,0.9961
Wisata,Pantai Kerrong,4.7,15,ibnul mufid,5,2021-10-15T04:02:46.537Z,Tempat keren dipulau bawean suasana alamnya masih asri,tempat keren dipulau bawean suasana alamnya masih asri,tempat bagus dipulau bawean suasana alamnya masih asri,tempat bagus dipulau bawean suasana alamnya asri,Lainnya,Negatif,0.9974
Wisata,Pantai Kerrong,4.7,15,Ahmad Fauzi,4,2020-02-25T12:12:08.649Z,just may be the other name for Pantai Mombhul since it's located just side by side. has many angles for u to photo shoot. bring ur own food there n enjoy the view,just may be the other name for pantai mombhul since it s located just side by side has many angles for u to photo shoot bring ur own food there n enjoy the view,just may be the other name for pantai mombhul since it s located just side by side has many angles for u to photo shoot bring ur own food there n enjoy the view,just may be the other name for pantai mombhul since it located just side by side has many angles for to photo shoot bring ur own food there enjoy the view,Lainnya,Negatif,0.5617
