Kategori,Tempat,Rating Tempat,Total Ulasan,Nama Reviewer,Bintang,Tanggal,Ulasan,teks_cleaned,teks_normalized,teks_final,topik,sentimen,sentimen_score
Lainnya,Trisakti Ketanen Soccerfield,5,9,khoirul nasir,5,2026-05-25T08:01:22.446Z,Tidak mengecewakan,tidak mengecewakan,tidak mengecewakan,mengecewakan,Lainnya,Positif,0.9978
Lainnya,Trisakti Ketanen Soccerfield,5,9,Ciwo Maulana,5,2026-05-25T07:53:40.077Z,"Mantap saya pernah main bola di sana... Lapangan sangat nyaman di gunakan, rumput sangat merata.  Sedikit saran mungkin bisa di kasih jaring di bagian barat lapangan agar tendangan bola yg melenceng tidak sampai ke jalan raya.  Over all - good Lapangan Trisakti Ketanen the best.",mantap saya pernah main bola di sana lapangan sangat nyaman di gunakan rumput sangat merata sedikit saran mungkin bisa di kasih jaring di bagian barat lapangan agar tendangan bola yg melenceng tidak sampai ke jalan raya over all good lapangan trisakti ketanen the best,bagus saya pernah main bola di sana lapangan sangat nyaman di gunakan rumput sangat merata sedikit saran mungkin bisa di kasih jaring di bagian barat lapangan agar tendangan bola yang melenceng tidak sampai ke jalan raya over all good lapangan trisakti ketanen the best,bagus pernah main bola sana lapangan nyaman gunakan rumput merata sedikit saran mungkin kasih jaring bagian barat lapangan agar tendangan bola melenceng sampai jalan raya over all good lapangan trisakti ketanen the best,Fasilitas,Negatif,0.9909
Lainnya,Trisakti Ketanen Soccerfield,5,9,Alan M3H,5,2026-05-19T11:07:22.089Z,Paket komplit...!!!,paket komplit,paket komplit,paket komplit,Lainnya,Negatif,0.995
Lainnya,Trisakti Ketanen Soccerfield,5,9,Rohmat Syahri,5,2026-05-19T10:49:35.784Z,"Lapangan sangat bagus dan berkualitas, rumput juga sangat bagus di rawat, mantaap kak 🥰",lapangan sangat bagus dan berkualitas rumput juga sangat bagus di rawat mantaap kak,lapangan sangat bagus dan berkualitas rumput juga sangat bagus di rawat mantaap kak,lapangan bagus berkualitas rumput bagus rawat mantaap kak,Kesehatan,Negatif,0.9958
Lainnya,Trisakti Ketanen Soccerfield,5,9,Eris Joni,5,2026-05-19T09:01:53.986Z,Rumputnya bagus serasa main di Camp Nou 😁,rumputnya bagus serasa main di camp nou,rumputnya bagus serasa main di camp nou,rumputnya bagus serasa main camp nou,Lainnya,Negatif,0.9969
