Kategori,Tempat,Rating Tempat,Total Ulasan,Nama Reviewer,Bintang,Tanggal,Ulasan,teks_cleaned,teks_normalized,teks_final,topik,sentimen,sentimen_score
Wisata,Makam Panjang,4.8,22,Muhammad Yusuf,5,2025-09-10T10:21:04.666Z,sangt perfect,sangt perfect,sangt perfect,sangt perfect,Lainnya,Negatif,0.8877
Wisata,Makam Panjang,4.8,22,Widodo S,5,2025-08-06T01:58:41.566Z,"Pemandangan bagus, pantai pandai ombak tenang , banyak jualan jajan n kopi, suasana tenang",pemandangan bagus pantai pandai ombak tenang banyak jualan jajan n kopi suasana tenang,pemandangan bagus pantai pandai ombak tenang banyak jualan jajan n kopi suasana tenang,pemandangan bagus pantai pandai ombak tenang banyak jualan jajan kopi suasana tenang,Lainnya,Negatif,0.9967
Wisata,Makam Panjang,4.8,22,Citra Purna Rafa utama,5,2025-07-02T05:07:27.861Z,"bagus bgt tempatnya, cuma kurang tempat² yg indah buat foto²",bagus bgt tempatnya cuma kurang tempat yg indah buat foto,bagus banget tempatnya cuma kurang tempat yang indah buat foto,bagus banget tempatnya cuma kurang tempat indah buat foto,Lainnya,Negatif,0.9966
Wisata,Makam Panjang,4.8,22,Reven Syah Putra,5,2025-04-09T22:52:10.048Z,wisata sdh sangat tertata dan terkelola..,wisata sdh sangat tertata dan terkelola,wisata sudah sangat tertata dan terkelola,wisata tertata terkelola,Lainnya,Negatif,0.9886
Wisata,Makam Panjang,4.8,22,Khairatun Nahisa,5,2024-08-20T05:44:34.138Z,Langsung terhubung dengan pantai nya,langsung terhubung dengan pantai nya,langsung terhubung dengan pantai nya,langsung terhubung pantai,Lainnya,Netral,0.674
Wisata,Makam Panjang,4.8,22,Adi Al Banna,5,2024-06-04T07:17:01.641Z,Wisata religi,wisata religi,wisata religi,wisata religi,Lainnya,Negatif,0.9891
Wisata,Makam Panjang,4.8,22,Bu Masita,5,2023-09-27T13:31:13.337Z,Tidak ada kamar mandi,tidak ada kamar mandi,tidak ada kamar mandi,kamar mandi,Lainnya,Netral,0.9481
