Kategori,Tempat,Rating Tempat,Total Ulasan,Nama Reviewer,Bintang,Tanggal,Ulasan,teks_cleaned,teks_normalized,teks_final,topik,sentimen,sentimen_score
Kesehatan,Puskesmas Sidayu,3.9,77,Rafika Aisyah,1,2025-11-14T00:42:50.710Z,"Pelayanannya lama banget, udh ada dokternya dan udah antri banyak tapi tetep gak dipanggil-panggil padahal udah jam operasional",pelayanannya lama banget udh ada dokternya dan udah antri banyak tapi tetep gak dipanggil panggil padahal udah jam operasional,pelayanannya lama banget udh ada dokternya dan udah antrian banyak tapi tetep tidak dipanggil panggil padahal udah jam operasional,pelayanannya lama banget udh dokternya udah antrian banyak tetep dipanggil panggil padahal udah jam operasional,Pelayanan,Positif,0.9978
Kesehatan,Puskesmas Sidayu,3.9,77,youtubeku001,1,2025-08-19T02:17:54.006Z,Kurang prefesional,kurang prefesional,kurang prefesional,kurang prefesional,Lainnya,Positif,0.9932
Kesehatan,Puskesmas Sidayu,3.9,77,Adhe Adhecha,1,2025-08-09T01:41:34.143Z,"puskesmas terburuk, pelayanan buruk",puskesmas terburuk pelayanan buruk,puskesmas terburuk pelayanan buruk,puskesmas terburuk pelayanan buruk,Pelayanan,Positif,0.997
Kesehatan,Puskesmas Sidayu,3.9,77,Faisol Afriyansah,1,2025-07-14T02:15:30.911Z,Pelayanan untuk ibu hamil sangat lama sekali Padahal tidak antri TPI untuk USG  membutuhkan waktu lebih dari 3 jam,pelayanan untuk ibu hamil sangat lama sekali padahal tidak antri tpi untuk usg membutuhkan waktu lebih dari jam,pelayanan untuk ibu hamil sangat lama sekali padahal tidak antrian tapi untuk usg membutuhkan waktu lebih dari jam,pelayanan ibu hamil lama padahal antrian usg membutuhkan waktu jam,Pelayanan,Positif,0.954
Kesehatan,Puskesmas Sidayu,3.9,77,rizky Caesariaputri,5,2025-03-24T04:17:05.906Z,"Pengalaman melahirkan anak pertama disini pakai bpjs alhamdulillah bidannya baik”, sabar nghadepin pasien, anak lahir langsung diajari menyusui, suasana juga nyaman, makasih buat bidan” yg sudah membantu🫶🏻 melahirkan di faskes 1 pelayanannya cukup baik kok, makanan nya ya lumayan enak hehe",pengalaman melahirkan anak pertama disini pakai bpjs alhamdulillah bidannya baik sabar nghadepin pasien anak lahir langsung diajari menyusui suasana juga nyaman makasih buat bidan yg sudah membantu melahirkan di faskes pelayanannya cukup baik kok makanan nya ya lumayan enak hehe,pengalaman melahirkan anak pertama disini pakai bpjs alhamdulillah bidannya baik sabar nghadepin pasien anak lahir langsung diajari menyusui suasana juga nyaman makasih buat bidan yang sudah membantu melahirkan di faskes pelayanannya cukup baik kok makanan nya ya lumayan enak,pengalaman melahirkan anak pertama disini pakai bpjs alhamdulillah bidannya baik sabar nghadepin pasien anak lahir langsung diajari menyusui suasana nyaman makasih buat bidan membantu melahirkan faskes pelayanannya cukup baik kok makanan ya lumayan enak,Pelayanan,Negatif,0.9972
Kesehatan,Puskesmas Sidayu,3.9,77,Faiz Jun,2,2024-12-23T04:15:42.660Z,"Kinerja dokternya kurang satset, istri saya periksa tes lab tapi tidak dikasih print hasil test lab terus tulisan yg di buku kia tidak ditulis harus ngomong dulu baru dikasih hasil lab tapi nulisnya hasil lab fi buku juga keliru  Tolong diperbaiki lagi untuk kedepannya",kinerja dokternya kurang satset istri saya periksa tes lab tapi tidak dikasih print hasil test lab terus tulisan yg di buku kia tidak ditulis harus ngomong dulu baru dikasih hasil lab tapi nulisnya hasil lab fi buku juga keliru tolong diperbaiki lagi untuk kedepannya,kinerja dokternya kurang satset istri saya periksa tes lab tapi tidak dikasih print hasil test lab terus tulisan yang di buku kia tidak ditulis harus ngomong dulu baru dikasih hasil lab tapi nulisnya hasil lab fi buku juga keliru tolong diperbaiki lagi untuk kedepannya,kinerja dokternya kurang satset istri periksa tes lab dikasih print hasil test lab terus tulisan buku kia ditulis harus ngomong dulu dikasih hasil lab nulisnya hasil lab fi buku keliru tolong diperbaiki kedepannya,Kesehatan,Positif,0.9937
Kesehatan,Puskesmas Sidayu,3.9,77,Masri Haryo,5,2024-12-09T13:26:25.061Z,Pelayanan ramah dan cepat... terimakasih Hasil lab pun keluar cepat,pelayanan ramah dan cepat terimakasih hasil lab pun keluar cepat,pelayanan ramah dan cepat terimakasih hasil lab pun keluar cepat,pelayanan ramah cepat terimakasih hasil lab keluar cepat,Pelayanan,Negatif,0.9803
Kesehatan,Puskesmas Sidayu,3.9,77,Fitri Dinaagustin,1,2024-10-22T02:36:13.687Z,"Tolonggg dengan sangat""pelayanan d perbaiki dengan BAIK!!!!!!",tolonggg dengan sangat pelayanan d perbaiki dengan baik,tolonggg dengan sangat pelayanan d perbaiki dengan baik,tolonggg pelayanan perbaiki baik,Pelayanan,Positif,0.9572
Kesehatan,Puskesmas Sidayu,3.9,77,Ishrokhiyah Maulidina,1,2024-10-04T01:07:54.978Z,"Dateng dulu, dipanggil terakhir",dateng dulu dipanggil terakhir,dateng dulu dipanggil terakhir,dateng dulu dipanggil terakhir,Lainnya,Netral,0.9932
Kesehatan,Puskesmas Sidayu,3.9,77,Icha Ichoo,2,2023-12-05T04:01:56.000Z,"Petugas pendaftarannya jutek poll, riweh, nggak senyum sama sekali. Yg bikin males ke puskesmas ya gini",petugas pendaftarannya jutek poll riweh nggak senyum sama sekali yg bikin males ke puskesmas ya gini,petugas pendaftarannya jutek poll riweh tidak senyum sama sekali yang bikin males ke puskesmas ya gini,petugas pendaftarannya jutek poll riweh senyum sama bikin males puskesmas ya gini,Pelayanan,Positif,0.9979
Kesehatan,Puskesmas Sidayu,3.9,77,Duapuluh Channel,3,2023-03-20T14:27:46.206Z,Tingkatkan lagi kebersihannya,tingkatkan lagi kebersihannya,tingkatkan lagi kebersihannya,tingkatkan kebersihannya,Fasilitas,Negatif,0.967
Kesehatan,Puskesmas Sidayu,3.9,77,Dodolanku Laris,1,2022-12-03T13:13:51.016Z,"org2 yg g berattitude DAN g berkompeten skolah lg aj, nanti sy bayari klu mau",org2 yg g berattitude dan g berkompeten skolah lg aj nanti sy bayari klu mau,org2 yang g berattitude dan g berkompeten skolah lg aj nanti saya bayari kalau mau,org2 berattitude berkompeten skolah lg aj nanti bayari mau,Lainnya,Positif,0.9492
Kesehatan,Puskesmas Sidayu,3.9,77,Bcs Khadafi,1,2022-08-24T03:31:36.100Z,"habis nganterin adik vaksin dosis 2 disini dan memang adek saya gk bawa kertas vaksin yg pertama di karenakan hilang... nakes yg bagian lain pelayanan nya bagus dan memaklumi klo kartu vaksin nya hilang TAPI TIDAK BERLAKU UNTUK MBK NAKES YG BAGIAN TENSI DARAH SEMPAT BICARA DENGAN NADA TINGGI KE ADEK SAYA GRGR KARTU NYA HILANG....  SAYA RASA SEBAGAI NAKES KURANG ETIS MENEGUR PASIEN DENGAN NADA TINGGI DI DEPAN BANYAK ORANG YG ANTRI VAKSIN..!!! kejadian tgl 24 agustus 2022 sekitar jm 09.15 pagi, tlg attitude nya dlm menangani pasien di perbaiki terutama pasien lansia.",habis nganterin adik vaksin dosis disini dan memang adek saya gk bawa kertas vaksin yg pertama di karenakan hilang nakes yg bagian lain pelayanan nya bagus dan memaklumi klo kartu vaksin nya hilang tapi tidak berlaku untuk mbk nakes yg bagian tensi darah sempat bicara dengan nada tinggi ke adek saya grgr kartu nya hilang saya rasa sebagai nakes kurang etis menegur pasien dengan nada tinggi di depan banyak orang yg antri vaksin kejadian tgl agustus sekitar jm pagi tlg attitude nya dlm menangani pasien di perbaiki terutama pasien lansia,habis nganterin adik vaksin dosis disini dan memang adek saya tidak bawa kertas vaksin yang pertama di karenakan hilang nakes yang bagian lain pelayanan nya bagus dan memaklumi kalau kartu vaksin nya hilang tapi tidak berlaku untuk mbk nakes yang bagian tensi darah sempat bicara dengan nada tinggi ke adek saya grgr kartu nya hilang saya rasa sebagai nakes kurang etis menegur pasien dengan nada tinggi di depan banyak orang yang antrian vaksin kejadian tgl agustus sekitar jm pagi tlg attitude nya dalam menangani pasien di perbaiki terutama pasien lansia,habis nganterin adik vaksin dosis disini memang adek bawa kertas vaksin pertama karenakan hilang nakes bagian lain pelayanan bagus memaklumi kartu vaksin hilang berlaku mbk nakes bagian tensi darah sempat bicara nada tinggi adek grgr kartu hilang rasa sebagai nakes kurang etis menegur pasien nada tinggi depan banyak orang antrian vaksin kejadian tgl agustus sekitar jm pagi tlg attitude menangani pasien perbaiki terutama pasien lansia,Pelayanan,Positif,0.9115
Kesehatan,Puskesmas Sidayu,3.9,77,Je anne,1,2022-08-24T02:47:52.018Z,"hbs vaksin disana, Nakes nya ga ber attitude, vaksin sm mama saya yg udh tua gatau prosedur dijelasin sambil bentak2 dan nyolot matanya. yg pake kacamata bagian tensi. pecat aja nakes kok attitude nya seperti jualan pindang",hbs vaksin disana nakes nya ga ber attitude vaksin sm mama saya yg udh tua gatau prosedur dijelasin sambil bentak2 dan nyolot matanya yg pake kacamata bagian tensi pecat aja nakes kok attitude nya seperti jualan pindang,hbs vaksin disana nakes nya tidak ber attitude vaksin sama mama saya yang udh tua gatau prosedur dijelasin sambil bentak2 dan nyolot matanya yang pake kacamata bagian tensi pecat aja nakes kok attitude nya seperti jualan pindang,hbs vaksin disana nakes ber attitude vaksin sama mama udh tua gatau prosedur dijelasin sambil bentak2 nyolot matanya pake kacamata bagian tensi pecat aja nakes kok attitude seperti jualan pindang,Fasilitas,Positif,0.9959
Kesehatan,Puskesmas Sidayu,3.9,77,abi E,5,2022-08-15T08:04:55.634Z,Mantab,mantab,mantab,mantab,Lainnya,Negatif,0.9971
Kesehatan,Puskesmas Sidayu,3.9,77,Reza Fitri Ayu Lestari,1,2022-07-25T03:41:29.133Z,"Tidak jelas dan tidak ramah, marah2",tidak jelas dan tidak ramah marah2,tidak jelas dan tidak ramah marah2,jelas ramah marah2,Pelayanan,Positif,0.9977
Kesehatan,Puskesmas Sidayu,3.9,77,Umrotus Saidah,5,2022-05-22T03:15:10.707Z,Puskesmas sidayu pelayanan nya baik top bgt,puskesmas sidayu pelayanan nya baik top bgt,puskesmas sidayu pelayanan nya baik top banget,puskesmas sidayu pelayanan baik top banget,Pelayanan,Negatif,0.9968
Kesehatan,Puskesmas Sidayu,3.9,77,Wiwin Sulistyo,5,2022-05-20T04:30:26.528Z,Pernah periksa di poli IVA.. Alhamdulillah pelayanan ramah dan memuaskan...,pernah periksa di poli iva alhamdulillah pelayanan ramah dan memuaskan,pernah periksa di poli iva alhamdulillah pelayanan ramah dan memuaskan,pernah periksa poli iva alhamdulillah pelayanan ramah memuaskan,Pelayanan,Negatif,0.9134
Kesehatan,Puskesmas Sidayu,3.9,77,ANNI SETIAWATI,5,2022-05-20T04:28:10.480Z,Pelayanannya memuaskan petugas ramah sip deh... Ada kenangan di pengambilan obat... Terimas kasih...,pelayanannya memuaskan petugas ramah sip deh ada kenangan di pengambilan obat terimas kasih,pelayanannya memuaskan petugas ramah sip deh ada kenangan di pengambilan obat terimas kasih,pelayanannya memuaskan petugas ramah sip kenangan pengambilan obat terimas kasih,Pelayanan,Negatif,0.9627
