Kategori,Tempat,Rating Tempat,Total Ulasan,Nama Reviewer,Bintang,Tanggal,Ulasan,teks_cleaned,teks_normalized,teks_final,topik,sentimen,sentimen_score
Kesehatan,Klinik Satelit Kalimantan,4.1,731,Nifa Gresik,5,2026-07-17T03:18:34.661Z,puas pelayanannya sangat baik,puas pelayanannya sangat baik,puas pelayanannya sangat baik,puas pelayanannya baik,Pelayanan,Negatif,0.9964
Kesehatan,Klinik Satelit Kalimantan,4.1,731,Avant Garde,5,2026-07-17T02:03:13.552Z,pelayanannya bagus,pelayanannya bagus,pelayanannya bagus,pelayanannya bagus,Pelayanan,Negatif,0.9974
Kesehatan,Klinik Satelit Kalimantan,4.1,731,Sandy Agung,1,2026-07-16T16:35:30.916Z,Biarkan berita yang berbicara,biarkan berita yang berbicara,biarkan berita yang berbicara,biarkan berita berbicara,Lainnya,Netral,0.6007
Kesehatan,Klinik Satelit Kalimantan,4.1,731,Neny Budiwiarti,5,2026-07-13T01:48:16.121Z,Menurut saya sudah baik pelayanan nya,menurut saya sudah baik pelayanan nya,menurut saya sudah baik pelayanan nya,menurut baik pelayanan,Pelayanan,Negatif,0.8938
Kesehatan,Klinik Satelit Kalimantan,4.1,731,andri kurniawan,1,2026-07-08T11:23:36.695Z,"Di sini antrian poli umum BPJS kurang terorganisir jadi pasti lama nunggunya dan kurang efektif ,apalagi saat dokter sedang istirahat,tidak ada pemberitahuan sama sekali ke pasien,sehingga pasien menunggu dengan tidak jelas",di sini antrian poli umum bpjs kurang terorganisir jadi pasti lama nunggunya dan kurang efektif apalagi saat dokter sedang istirahat tidak ada pemberitahuan sama sekali ke pasien sehingga pasien menunggu dengan tidak jelas,di sini antrian poli umum bpjs kurang terorganisir jadi pasti lama nunggunya dan kurang efektif apalagi saat dokter sedang istirahat tidak ada pemberitahuan sama sekali ke pasien sehingga pasien menunggu dengan tidak jelas,sini antrian poli umum bpjs kurang terorganisir jadi pasti lama nunggunya kurang efektif apalagi dokter sedang istirahat pemberitahuan sama pasien sehingga pasien menunggu jelas,Pelayanan,Positif,0.9827
Kesehatan,Klinik Satelit Kalimantan,4.1,731,Nurjanah Nurjanah,5,2026-07-07T09:03:37.868Z,"Promo pembersihan karang gigi dengan dokter arinil,sangat nyaman dan mantab",promo pembersihan karang gigi dengan dokter arinil sangat nyaman dan mantab,promo pembersihan karang gigi dengan dokter arinil sangat nyaman dan mantab,promo pembersihan karang gigi dokter arinil nyaman mantab,Fasilitas,Negatif,0.9911
Kesehatan,Klinik Satelit Kalimantan,4.1,731,riski upzz,5,2026-07-06T02:40:33.266Z,Dapat potongan dr gigi,dapat potongan dr gigi,dapat potongan dari gigi,potongan gigi,Lainnya,Positif,0.8761
Kesehatan,Klinik Satelit Kalimantan,4.1,731,Rifdah Fa'iqotul Himmah,5,2026-07-02T11:58:30.495Z,"Pelayanan ramah, sukses selalu klinik satelit kalimantan!!!!",pelayanan ramah sukses selalu klinik satelit kalimantan,pelayanan ramah sukses selalu klinik satelit kalimantan,pelayanan ramah sukses selalu klinik satelit kalimantan,Pelayanan,Negatif,0.9885
Kesehatan,Klinik Satelit Kalimantan,4.1,731,36_ Lailah Rofi'atun N.,5,2026-07-02T11:58:00.657Z,"Semoga semakin sukses, kakak""nya tetap ramah, bermanfaat bagi masyarakat",semoga semakin sukses kakak nya tetap ramah bermanfaat bagi masyarakat,semoga semakin sukses kakak nya tetap ramah bermanfaat bagi masyarakat,semoga semakin sukses kakak tetap ramah bermanfaat bagi masyarakat,Pelayanan,Negatif,0.9622
Kesehatan,Klinik Satelit Kalimantan,4.1,731,Udhiya,5,2026-07-02T11:21:35.817Z,"Pelayanan ramah, cepat dan profesional",pelayanan ramah cepat dan profesional,pelayanan ramah cepat dan profesional,pelayanan ramah cepat profesional,Pelayanan,Negatif,0.9948
Kesehatan,Klinik Satelit Kalimantan,4.1,731,Masning Rizqiyah,5,2026-07-02T09:36:22.830Z,Klinik satelit pelayanan lebih baik,klinik satelit pelayanan lebih baik,klinik satelit pelayanan lebih baik,klinik satelit pelayanan baik,Pelayanan,Negatif,0.9899
Kesehatan,Klinik Satelit Kalimantan,4.1,731,Gauri Eatery,5,2026-07-02T09:20:59.356Z,Harganya nya terjangkau,harganya nya terjangkau,harganya nya terjangkau,harganya terjangkau,Lainnya,Negatif,0.9973
Kesehatan,Klinik Satelit Kalimantan,4.1,731,Siani KPR Mandiri,5,2026-07-02T09:18:06.287Z,Pelayanan baik,pelayanan baik,pelayanan baik,pelayanan baik,Pelayanan,Negatif,0.9952
Kesehatan,Klinik Satelit Kalimantan,4.1,731,Anik Anik,5,2026-07-02T09:14:59.564Z,Pelayanannya oke,pelayanannya oke,pelayanannya oke,pelayanannya oke,Pelayanan,Negatif,0.9969
Kesehatan,Klinik Satelit Kalimantan,4.1,731,Moonlight Marry,5,2026-06-30T05:07:37.805Z,pelayanan makin bagus,pelayanan makin bagus,pelayanan makin bagus,pelayanan makin bagus,Pelayanan,Negatif,0.9968
Kesehatan,Klinik Satelit Kalimantan,4.1,731,Ahmad Alidrus,5,2026-06-17T07:47:25.441Z,Pelayanan sudah baik dan ramah,pelayanan sudah baik dan ramah,pelayanan sudah baik dan ramah,pelayanan baik ramah,Pelayanan,Negatif,0.995
Kesehatan,Klinik Satelit Kalimantan,4.1,731,Anggitayeye Putri22,1,2026-06-17T03:13:45.927Z,"Kemarin periksa kesini dan di injeksi,,pas penyuntikan terjadi kesalahan,,jadi pembuluh darah pecah dan bengkak,udah seminggu masih sakit,,dan sebelumnya disuruh datang kembali kalo masih sakit,,,pas datang kembali ternyata ada biaya lagi,beli obat lagi,,,saya kira ada pertanggung jawaban,ternyata tidak,,okelah jika itu tidak ada,,saya masih mampu untuk bayar,tapi udah males,,karena perkataan dokternya,kita datang berobat biar sembuh,oke sakitnya sembuh ,,tapi ganti sakit karena kesalahan tadi,,,dan dokternya bilang ya itu resiko,,,lahhhh?????? masak orang sakit datang  berobat biar sembuh malah di suruh nanggung resiko",kemarin periksa kesini dan di injeksi pas penyuntikan terjadi kesalahan jadi pembuluh darah pecah dan bengkak udah seminggu masih sakit dan sebelumnya disuruh datang kembali kalo masih sakit pas datang kembali ternyata ada biaya lagi beli obat lagi saya kira ada pertanggung jawaban ternyata tidak okelah jika itu tidak ada saya masih mampu untuk bayar tapi udah males karena perkataan dokternya kita datang berobat biar sembuh oke sakitnya sembuh tapi ganti sakit karena kesalahan tadi dan dokternya bilang ya itu resiko lahhhh masak orang sakit datang berobat biar sembuh malah di suruh nanggung resiko,kemarin periksa kesini dan di injeksi pas penyuntikan terjadi kesalahan jadi pembuluh darah pecah dan bengkak udah seminggu masih sakit dan sebelumnya disuruh datang kembali kalo masih sakit pas datang kembali ternyata ada biaya lagi beli obat lagi saya kira ada pertanggung jawaban ternyata tidak okelah jika itu tidak ada saya masih mampu untuk bayar tapi udah males karena perkataan dokternya kita datang berobat biar sembuh oke sakitnya sembuh tapi ganti sakit karena kesalahan tadi dan dokternya bilang ya itu resiko lahhhh masak orang sakit datang berobat biar sembuh malah di suruh nanggung resiko,kemarin periksa kesini injeksi pas penyuntikan terjadi kesalahan jadi pembuluh darah pecah bengkak udah seminggu sakit sebelumnya disuruh datang kembali kalo sakit pas datang kembali ternyata biaya beli obat kira pertanggung jawaban ternyata okelah mampu bayar udah males perkataan dokternya datang berobat biar sembuh oke sakitnya sembuh ganti sakit kesalahan tadi dokternya bilang ya resiko lahhhh masak orang sakit datang berobat biar sembuh malah suruh nanggung resiko,Kesehatan,Positif,0.9945
Kesehatan,Klinik Satelit Kalimantan,4.1,731,Luthfi MuhammadNur,1,2026-06-12T01:14:20.278Z,"Aturan nya pendaftaran sering berubah. Terakhir asam lambung naik dada sesak panas. Ke UGD Sruh ke poli umum dulu, sdah daftar online tidak dipanggil ternyata harus lapor loket dulu. Sdah daftar loket tdak di panggil 1jam lebih. Saat sdah di panggil ke poli 3 ternyata surat mengarah ke poli 1 dan di suruh antri lagi hampir 3 jam nahan dada panas dan sesak. Akhirnya saya pulang dengan rasa kecewa penanganan dr klinik satelit. BPJS kelas 1 saja pelayanan seperti ini apalagi 2 dan 3.",aturan nya pendaftaran sering berubah terakhir asam lambung naik dada sesak panas ke ugd sruh ke poli umum dulu sdah daftar online tidak dipanggil ternyata harus lapor loket dulu sdah daftar loket tdak di panggil 1jam lebih saat sdah di panggil ke poli ternyata surat mengarah ke poli dan di suruh antri lagi hampir jam nahan dada panas dan sesak akhirnya saya pulang dengan rasa kecewa penanganan dr klinik satelit bpjs kelas saja pelayanan seperti ini apalagi dan,aturan nya pendaftaran sering berubah terakhir asam lambung naik dada sesak panas ke ugd sruh ke poli umum dulu sdah daftar online tidak dipanggil ternyata harus lapor loket dulu sdah daftar loket tdak di panggil 1jam lebih saat sdah di panggil ke poli ternyata surat mengarah ke poli dan di suruh antrian lagi hampir jam nahan dada panas dan sesak akhirnya saya pulang dengan rasa kecewa penanganan dari klinik satelit bpjs kelas saja pelayanan seperti ini apalagi dan,aturan pendaftaran sering berubah terakhir asam lambung naik dada sesak panas ugd sruh poli umum dulu sdah daftar online dipanggil ternyata harus lapor loket dulu sdah daftar loket tdak panggil 1jam sdah panggil poli ternyata surat mengarah poli suruh antrian hampir jam nahan dada panas sesak akhirnya pulang rasa kecewa penanganan klinik satelit bpjs kelas saja pelayanan seperti apalagi,Pelayanan,Positif,0.9964
